{
 "$schema": "schema/resolved.schema.json",
 "source": {
  "repo": "microsoft/fluentui",
  "commit": "45af037915bae19733ffb8cb2123d8e6e216e881",
  "package": "@fluentui/tokens",
  "version": "1.0.0-alpha.24"
 },
 "modes": {
  "value": "webLightTheme",
  "dark": "webDarkTheme",
  "highContrast": "teamsHighContrastTheme",
  "teamsLight": "teamsLightTheme",
  "teamsDark": "teamsDarkTheme"
 },
 "units": "px for dimensions, ms for durations, cubicBezier as [x1, y1, x2, y2], colours as #rrggbb or #rrggbbaa (the source's rgba() and transparent normalised), shadows as layers of {x, y, blur, color}",
 "tokens": {
  "tokens.borderRadiusNone": {
   "tier": "global",
   "type": "dimension",
   "value": 0
  },
  "tokens.borderRadiusSmall": {
   "tier": "global",
   "type": "dimension",
   "value": 2
  },
  "tokens.borderRadiusMedium": {
   "tier": "global",
   "type": "dimension",
   "value": 4
  },
  "tokens.borderRadiusLarge": {
   "tier": "global",
   "type": "dimension",
   "value": 6
  },
  "tokens.borderRadiusXLarge": {
   "tier": "global",
   "type": "dimension",
   "value": 8
  },
  "tokens.borderRadius2XLarge": {
   "tier": "global",
   "type": "dimension",
   "value": 12
  },
  "tokens.borderRadius3XLarge": {
   "tier": "global",
   "type": "dimension",
   "value": 16
  },
  "tokens.borderRadius4XLarge": {
   "tier": "global",
   "type": "dimension",
   "value": 24
  },
  "tokens.borderRadius5XLarge": {
   "tier": "global",
   "type": "dimension",
   "value": 32
  },
  "tokens.borderRadius6XLarge": {
   "tier": "global",
   "type": "dimension",
   "value": 40
  },
  "tokens.borderRadiusCircular": {
   "tier": "global",
   "type": "dimension",
   "value": 10000
  },
  "tokens.fontSizeBase100": {
   "tier": "global",
   "type": "dimension",
   "value": 10
  },
  "tokens.fontSizeBase200": {
   "tier": "global",
   "type": "dimension",
   "value": 12
  },
  "tokens.fontSizeBase300": {
   "tier": "global",
   "type": "dimension",
   "value": 14
  },
  "tokens.fontSizeBase400": {
   "tier": "global",
   "type": "dimension",
   "value": 16
  },
  "tokens.fontSizeBase500": {
   "tier": "global",
   "type": "dimension",
   "value": 20
  },
  "tokens.fontSizeBase600": {
   "tier": "global",
   "type": "dimension",
   "value": 24
  },
  "tokens.fontSizeHero700": {
   "tier": "global",
   "type": "dimension",
   "value": 28
  },
  "tokens.fontSizeHero800": {
   "tier": "global",
   "type": "dimension",
   "value": 32
  },
  "tokens.fontSizeHero900": {
   "tier": "global",
   "type": "dimension",
   "value": 40
  },
  "tokens.fontSizeHero1000": {
   "tier": "global",
   "type": "dimension",
   "value": 68
  },
  "tokens.lineHeightBase100": {
   "tier": "global",
   "type": "dimension",
   "value": 14
  },
  "tokens.lineHeightBase200": {
   "tier": "global",
   "type": "dimension",
   "value": 16
  },
  "tokens.lineHeightBase300": {
   "tier": "global",
   "type": "dimension",
   "value": 20
  },
  "tokens.lineHeightBase400": {
   "tier": "global",
   "type": "dimension",
   "value": 22
  },
  "tokens.lineHeightBase500": {
   "tier": "global",
   "type": "dimension",
   "value": 28
  },
  "tokens.lineHeightBase600": {
   "tier": "global",
   "type": "dimension",
   "value": 32
  },
  "tokens.lineHeightHero700": {
   "tier": "global",
   "type": "dimension",
   "value": 36
  },
  "tokens.lineHeightHero800": {
   "tier": "global",
   "type": "dimension",
   "value": 40
  },
  "tokens.lineHeightHero900": {
   "tier": "global",
   "type": "dimension",
   "value": 52
  },
  "tokens.lineHeightHero1000": {
   "tier": "global",
   "type": "dimension",
   "value": 92
  },
  "tokens.fontFamilyBase": {
   "tier": "global",
   "type": "fontFamily",
   "value": "'Segoe UI', 'Segoe UI Web (West European)', -apple-system, BlinkMacSystemFont, Roboto, 'Helvetica Neue', sans-serif",
   "highContrast": "-apple-system, BlinkMacSystemFont, \"Segoe UI\", system-ui, \"Apple Color Emoji\", \"Segoe UI Emoji\", sans-serif",
   "teamsLight": "-apple-system, BlinkMacSystemFont, \"Segoe UI\", system-ui, \"Apple Color Emoji\", \"Segoe UI Emoji\", sans-serif",
   "teamsDark": "-apple-system, BlinkMacSystemFont, \"Segoe UI\", system-ui, \"Apple Color Emoji\", \"Segoe UI Emoji\", sans-serif"
  },
  "tokens.fontFamilyMonospace": {
   "tier": "global",
   "type": "fontFamily",
   "value": "Consolas, 'Courier New', Courier, monospace"
  },
  "tokens.fontFamilyNumeric": {
   "tier": "global",
   "type": "fontFamily",
   "value": "Bahnschrift, 'Segoe UI', 'Segoe UI Web (West European)', -apple-system, BlinkMacSystemFont, Roboto, 'Helvetica Neue', sans-serif"
  },
  "tokens.fontWeightRegular": {
   "tier": "global",
   "type": "fontWeight",
   "value": 400
  },
  "tokens.fontWeightMedium": {
   "tier": "global",
   "type": "fontWeight",
   "value": 500
  },
  "tokens.fontWeightSemibold": {
   "tier": "global",
   "type": "fontWeight",
   "value": 600
  },
  "tokens.fontWeightBold": {
   "tier": "global",
   "type": "fontWeight",
   "value": 700
  },
  "tokens.strokeWidthThin": {
   "tier": "global",
   "type": "dimension",
   "value": 1
  },
  "tokens.strokeWidthThick": {
   "tier": "global",
   "type": "dimension",
   "value": 2
  },
  "tokens.strokeWidthThicker": {
   "tier": "global",
   "type": "dimension",
   "value": 3
  },
  "tokens.strokeWidthThickest": {
   "tier": "global",
   "type": "dimension",
   "value": 4
  },
  "tokens.spacingHorizontalNone": {
   "tier": "global",
   "type": "dimension",
   "value": 0
  },
  "tokens.spacingHorizontalXXS": {
   "tier": "global",
   "type": "dimension",
   "value": 2
  },
  "tokens.spacingHorizontalXS": {
   "tier": "global",
   "type": "dimension",
   "value": 4
  },
  "tokens.spacingHorizontalSNudge": {
   "tier": "global",
   "type": "dimension",
   "value": 6
  },
  "tokens.spacingHorizontalS": {
   "tier": "global",
   "type": "dimension",
   "value": 8
  },
  "tokens.spacingHorizontalMNudge": {
   "tier": "global",
   "type": "dimension",
   "value": 10
  },
  "tokens.spacingHorizontalM": {
   "tier": "global",
   "type": "dimension",
   "value": 12
  },
  "tokens.spacingHorizontalL": {
   "tier": "global",
   "type": "dimension",
   "value": 16
  },
  "tokens.spacingHorizontalXL": {
   "tier": "global",
   "type": "dimension",
   "value": 20
  },
  "tokens.spacingHorizontalXXL": {
   "tier": "global",
   "type": "dimension",
   "value": 24
  },
  "tokens.spacingHorizontalXXXL": {
   "tier": "global",
   "type": "dimension",
   "value": 32
  },
  "tokens.spacingVerticalNone": {
   "tier": "global",
   "type": "dimension",
   "value": 0
  },
  "tokens.spacingVerticalXXS": {
   "tier": "global",
   "type": "dimension",
   "value": 2
  },
  "tokens.spacingVerticalXS": {
   "tier": "global",
   "type": "dimension",
   "value": 4
  },
  "tokens.spacingVerticalSNudge": {
   "tier": "global",
   "type": "dimension",
   "value": 6
  },
  "tokens.spacingVerticalS": {
   "tier": "global",
   "type": "dimension",
   "value": 8
  },
  "tokens.spacingVerticalMNudge": {
   "tier": "global",
   "type": "dimension",
   "value": 10
  },
  "tokens.spacingVerticalM": {
   "tier": "global",
   "type": "dimension",
   "value": 12
  },
  "tokens.spacingVerticalL": {
   "tier": "global",
   "type": "dimension",
   "value": 16
  },
  "tokens.spacingVerticalXL": {
   "tier": "global",
   "type": "dimension",
   "value": 20
  },
  "tokens.spacingVerticalXXL": {
   "tier": "global",
   "type": "dimension",
   "value": 24
  },
  "tokens.spacingVerticalXXXL": {
   "tier": "global",
   "type": "dimension",
   "value": 32
  },
  "tokens.durationUltraFast": {
   "tier": "global",
   "type": "duration",
   "value": 50
  },
  "tokens.durationFaster": {
   "tier": "global",
   "type": "duration",
   "value": 100
  },
  "tokens.durationFast": {
   "tier": "global",
   "type": "duration",
   "value": 150
  },
  "tokens.durationNormal": {
   "tier": "global",
   "type": "duration",
   "value": 200
  },
  "tokens.durationGentle": {
   "tier": "global",
   "type": "duration",
   "value": 250
  },
  "tokens.durationSlow": {
   "tier": "global",
   "type": "duration",
   "value": 300
  },
  "tokens.durationSlower": {
   "tier": "global",
   "type": "duration",
   "value": 400
  },
  "tokens.durationUltraSlow": {
   "tier": "global",
   "type": "duration",
   "value": 500
  },
  "tokens.curveAccelerateMax": {
   "tier": "global",
   "type": "cubicBezier",
   "value": [
    0.9,
    0.1,
    1,
    0.2
   ]
  },
  "tokens.curveAccelerateMid": {
   "tier": "global",
   "type": "cubicBezier",
   "value": [
    1,
    0,
    1,
    1
   ]
  },
  "tokens.curveAccelerateMin": {
   "tier": "global",
   "type": "cubicBezier",
   "value": [
    0.8,
    0,
    0.78,
    1
   ]
  },
  "tokens.curveDecelerateMax": {
   "tier": "global",
   "type": "cubicBezier",
   "value": [
    0.1,
    0.9,
    0.2,
    1
   ]
  },
  "tokens.curveDecelerateMid": {
   "tier": "global",
   "type": "cubicBezier",
   "value": [
    0,
    0,
    0,
    1
   ]
  },
  "tokens.curveDecelerateMin": {
   "tier": "global",
   "type": "cubicBezier",
   "value": [
    0.33,
    0,
    0.1,
    1
   ]
  },
  "tokens.curveEasyEaseMax": {
   "tier": "global",
   "type": "cubicBezier",
   "value": [
    0.8,
    0,
    0.2,
    1
   ]
  },
  "tokens.curveEasyEase": {
   "tier": "global",
   "type": "cubicBezier",
   "value": [
    0.33,
    0,
    0.67,
    1
   ]
  },
  "tokens.curveLinear": {
   "tier": "global",
   "type": "cubicBezier",
   "value": [
    0,
    0,
    1,
    1
   ]
  },
  "tokens.colorNeutralForeground1": {
   "tier": "alias",
   "type": "color",
   "value": "#242424",
   "dark": "#ffffff",
   "highContrast": "#ffffff",
   "teamsDark": "#ffffff",
   "alias": "global.grey.14"
  },
  "tokens.colorNeutralForeground1Hover": {
   "tier": "alias",
   "type": "color",
   "value": "#242424",
   "dark": "#ffffff",
   "highContrast": "#000000",
   "teamsDark": "#ffffff",
   "alias": "global.grey.14"
  },
  "tokens.colorNeutralForeground1Pressed": {
   "tier": "alias",